lead_id,school_name,city,website,domain,provider,source_query,address,phone,contact_email,contact_role,all_emails,primary_contact,linkedin_url,contact_form_url,contact_page,contact_method,contact_score,contact_priority_label,about_page,about_page_url,staff_page_url,personalization_hook,enriched_at,email1_path,followup_path,brief_path,notes
84e1d5c3-0316-45f4-872a-b8bd5e152a29,Downey Christian School,"Downey, CA",https://downeychristianschool.org/,downeychristianschool.org,serpapi,Private school Downey CA,"10335 Paramount Blvd, Downey, CA 90241",(562) 927-7540,,,,,,https://downeychristianschool.org/contact-us,,contact_form,40,Tier 4,,,,"At Downey Christian School in Downey, CA, we are dedicated to nurturing students from preschool through grade 8 with a comprehensive academic and spiritual curriculum that empowers them to reach their God-given potential.",2026-02-17T02:04:53.234652,,,,
1920af7a-9ed2-4961-a2e1-34ac2b597bca,Calvary Chapel Christian School,"Downey, CA",http://cccsdowney.org/,cccsdowney.org,serpapi,Private school Downey CA,"12808 Woodruff Ave, Downey, CA 90242",(562) 803-4076,,,,,,,,phone_only,20,Tier 5,,,,"At Calvary Chapel Christian School in Downey, CA, we are proud to offer a Christ-centered education from preschool through high school, guided by our commitment to nurturing students in a safe and enriching environment rooted in biblical principles.",2026-02-17T02:04:59.110701,,,,
7faddd66-3152-425c-88cb-9bc36959bd83,"Creative Beginnings Elementary, Inc","Downey, CA",http://cbekids.com/,cbekids.com,serpapi,Private school Downey CA,"8033 3rd St, Downey, CA 90241",(562) 861-1499,,,,,,,,phone_only,20,Tier 5,,,,"At Creative Beginnings Elementary in Downey, CA, we pride ourselves on fostering a nurturing environment that sparks creativity and academic excellence for every student.",2026-02-17T02:05:00.127821,,,,
393d1555-71b4-4b6a-a2de-9bcd7e2b8076,Ellemercito Academy,"Downey, CA",https://ellemercito.org/,ellemercito.org,serpapi,Private school Downey CA,"10544 Downey Ave, Downey, CA 90241",(562) 600-8406,connectedcuriosityla@gmail.com,generic,connectedcuriosityla@gmail.com;lvalles@ellemercito.org,connectedcuriosityla@gmail.com,,https://ellemercito.org/#contact-us,,general_email,55,Tier 3,,,,"At Ellemercito Academy in Downey, CA, we pride ourselves on offering a highly personalized, project-based education that nurtures each student's unique interests and fosters a love for learning in a supportive, micro school environment.",2026-02-17T02:05:16.658010,,,,
62c9f1d9-a7d4-4f6f-85d9-481a7efd7efb,Montessori Academy of Downey,"Downey, CA",http://montessori-academy.com/,montessori-academy.com,serpapi,Private school Downey CA,"7515 Firestone Blvd, Downey, CA 90241",(562) 291-2324,info@montessori-academy.com,office/info,info@montessori-academy.com,info@montessori-academy.com,,https://montessori-academy.com/contact-us/,,general_email,65,Tier 3,,,,"At Montessori Academy of Downey, we provide a year-round, exceptional Montessori education tailored to foster your child's unique learning journey in the heart of Downey, CA.",2026-02-17T02:05:28.854700,,,,
82f587a5-3b67-41ca-93e4-5de6840b1a5c,Kirkwood Christian School's Elementary,"Downey, CA",https://kirkwoodchristianschools.org/,kirkwoodchristianschools.org,serpapi,Private school Downey CA,"11115 Pangborn Ave, Downey, CA 90241",(562) 904-6911,,,,,,https://kirkwoodchristianschools.org/contact-us/,https://kirkwoodchristianschools.org/contact,contact_form,40,Tier 4,https://kirkwoodchristianschools.org/about,https://kirkwoodchristianschools.org/about,,"At Kirkwood Christian School's Elementary in Downey, CA, we are dedicated to nurturing each child's potential through a blend of Christian discipleship and academic excellence, ensuring a strong foundation for lifelong success.",2026-02-17T02:05:34.629611,,,,
9d21b0d6-28f9-4645-88b7-46f564abf814,Our Lady of Perpetual Help School,"Downey, CA",http://ourladyschool.com/,ourladyschool.com,serpapi,Private school Downey CA,"10441 Downey Ave, Downey, CA 90241",(562) 869-9969,,,,,,http://ourladyschool.com/contact.html,http://ourladyschool.com/contact,contact_form,40,Tier 4,http://ourladyschool.com/about,http://ourladyschool.com/about,,"At Our Lady of Perpetual Help School in Downey, CA, we proudly offer a Dual Language Immersion program that not only enriches our students' academic experience but also prepares them for success in selective Catholic high schools with a 100% acceptance rate.",2026-02-17T02:05:39.552804,,,,
a06be508-5512-4ef2-9882-8056f1a24bb1,St Raymond School,"Downey, CA",http://www.straymondschool-downey.org/,straymondschool-downey.org,serpapi,Private school Downey CA,"12320 Paramount Blvd, Downey, CA 90242",(562) 862-3210,,,,,,https://straymondschool-downey.org/contact/,http://www.straymondschool-downey.org/contact,contact_form,40,Tier 4,http://www.straymondschool-downey.org/about,http://www.straymondschool-downey.org/about,http://www.straymondschool-downey.org/staff,"At St. Raymond School in Downey, CA, we are dedicated to nurturing each student from TK to 8th grade to become engaged learners who embody the values of the Catholic faith while pursuing excellence in all aspects of their lives.",2026-02-17T02:06:10.637689,,,,
00618ba9-a88a-4f70-90b6-f9468b202bb3,Children's Academy of Success,"Downey, CA",https://www.childrensacademyofsuccess.org/contact-us,childrensacademyofsuccess.org,serpapi,Private school Downey CA,"10839 La Reina Ave Suite 100, Downey, CA 90241",(562) 231-4373,childrensacademyofsuccessca@gmail.com,generic,childrensacademyofsuccessca@gmail.com,childrensacademyofsuccessca@gmail.com,,https://www.childrensacademyofsuccess.org/contact-us,,general_email,55,Tier 3,,,,"At Children's Academy of Success in Downey, CA, we are dedicated to nurturing young minds from toddler through kindergarten, fostering a love for learning in a supportive and engaging environment.",2026-02-17T02:06:13.586421,,,,
0b345f02-c80d-4250-ba14-cfc568226930,Onward Scholars at St. Pius X-St. Matthias Academy,"Downey, CA",http://onwardscholars.org/st-pius-x-st-matthias-academy,onwardscholars.org,serpapi,Catholic school Downey CA,"7851 Gardendale St, Downey, CA 90242",(562) 861-2271,mturcios@onwardscholars.org,generic,mturcios@onwardscholars.org,mturcios@onwardscholars.org,https://www.linkedin.com/company/onward-scholars,,,linkedin,85,Tier 2,http://onwardscholars.org/about,http://onwardscholars.org/about,,"At Onward Scholars at St. Pius X-St. Matthias Academy in Downey, CA, we are dedicated to providing a transformative Catholic education that empowers students to grow in faith and achieve their academic goals.",2026-02-17T02:06:19.968625,,,,
92db0021-b40c-4a87-b3f1-3bc9a4cd55c0,Maria Montessori House,"Downey, CA",,,serpapi,Montessori Downey CA,"12067 Paramount Blvd, Downey, CA 90242",(562) 861-4308,,,,,,,,phone_only,20,Tier 5,,,,"At Maria Montessori House in Downey, CA, we foster a nurturing environment that emphasizes individualized learning and holistic development for every child.",2026-02-17T02:06:20.962213,,,,
9783ebaf-92c7-4bee-a255-b6f113197495,Downey Adult School,"Downey, CA",https://www.das.edu/,das.edu,serpapi,College prep Downey CA,"12340 Woodruff Ave, Downey, CA 90241",(562) 940-6200,DASWeCare@dusd.net,principal/head,DASWeCare@dusd.net;rdame@dusd.net;julgonzalez@dusd.net;brochin@dusd.net;tforeman@dusd.net,DASWeCare@dusd.net,,https://www.das.edu,,principal_email,100,Tier 1,https://www.das.edu/about,https://www.das.edu/about,https://www.das.edu/administration,"At Downey Adult School in Downey, CA, we are dedicated to providing high-quality career training and educational programs tailored to meet the diverse needs of our adult learners, ensuring they have the skills necessary for success in today's workforce.",2026-02-17T02:06:41.038595,,,,
b924ffc4-5048-4553-900c-ad63f7e2818a,L.A. Premier Prep,"Downey, CA",http://www.lapremierprep.com/,lapremierprep.com,serpapi,College prep Downey CA,"12544 Rives Ave, Downey, CA 90242",323 395 6338,Keion_Kindred@yahoo.com,generic,Keion_Kindred@yahoo.com;Kellis@downeyca.org,Keion_Kindred@yahoo.com,,https://lapremierprep.com/contact/,http://www.lapremierprep.com/contact,general_email,55,Tier 3,http://www.lapremierprep.com/about,http://www.lapremierprep.com/about,http://www.lapremierprep.com/staff,"At L.A. Premier Prep in Downey, CA, we are dedicated to elevating student-athletes through elite training and comprehensive player development, ensuring they excel both on the court and in life.",2026-02-17T02:06:53.148056,,,,
bfe11fde-a98a-4d31-92a6-dbe734af236e,Los Angeles College Prep Academy,"Downey, CA",http://www.lacpacademy.org/,lacpacademy.org,serpapi,College prep Downey CA,"625 Coleman Ave, Los Angeles, CA 90042",(323) 257-1499,,,,,,http://www.lacpacademy.org/search.php,http://www.lacpacademy.org/contact,contact_form,40,Tier 4,http://www.lacpacademy.org/about,http://www.lacpacademy.org/about,http://www.lacpacademy.org/staff,"At Los Angeles College Prep Academy in Downey, CA, we are dedicated to fostering a nurturing environment where every student is empowered to excel academically and personally, preparing them for success in a rapidly changing world.",2026-02-17T02:06:59.576284,,,,
c2aae2ef-2b62-4fdb-9c90-cf179c307eff,Rancho Dominguez Preparatory School,"Downey, CA",https://dominguezps.lausd.org/,dominguezps.lausd.org,serpapi,College prep Downey CA,"4110 Santa Fe Ave, Long Beach, CA 90810",(310) 847-6400,,,,,,,,phone_only,20,Tier 5,,,,"At Rancho Dominguez Preparatory School in Downey, CA, we pride ourselves on fostering a nurturing environment that empowers students to excel academically and develop their unique talents.",2026-02-17T02:07:00.867234,,,,
9540c47f-e9a7-4595-88b0-60c83d631456,Arcadia College Preparatory School,"Downey, CA",http://arcadiaprepschool.org/,arcadiaprepschool.org,serpapi,College prep Downey CA,"145 E Duarte Rd, Arcadia, CA 91006",(626) 398-2388,,,,,,,,phone_only,20,Tier 5,,,,"At Arcadia College Preparatory School in Downey, CA, we pride ourselves on fostering a nurturing environment that empowers students to excel academically and develop their unique talents.",2026-02-17T02:07:01.915027,,,,
49e5c0f4-b266-4ca9-9526-c4368899d902,California Preparatory College,"Downey, CA",http://www.calprepcollege.com/,calprepcollege.com,serpapi,College prep Downey CA,"245 E Redlands Blvd, San Bernardino, CA 92408",(909) 264-3255,info@calprepcollege.com,office/info,info@calprepcollege.com;records@calprepcollege.com,info@calprepcollege.com,,https://calprepcollege.com/courses/,http://www.calprepcollege.com/contact,general_email,65,Tier 3,http://www.calprepcollege.com/about,http://www.calprepcollege.com/about,http://www.calprepcollege.com/leadership,"At California Preparatory College in Downey, CA, we prioritize personalized mentoring and small class sizes to foster academic excellence and spiritual growth in our students.",2026-02-17T02:07:13.766916,,,,
14a09e4b-cbc0-4001-be8a-db638bcb85fc,California University Preparatory School,"Downey, CA",https://caluprep.com/,caluprep.com,serpapi,College prep Downey CA,"18760 Colima Rd, Rowland Heights, CA 91748",(626) 964-9588,,,,,,,,phone_only,20,Tier 5,,,,"At California University Preparatory School in Downey, CA, we have been dedicated to empowering international students for over 20 years, ensuring they achieve their academic goals while thriving in a supportive and culturally rich environment.",2026-02-17T02:07:16.738305,,,,
075a6028-25ef-4ec7-a322-2cf7e18486b1,The College Preparatory School,"Downey, CA",http://www.college-prep.org/,college-prep.org,serpapi,College prep Downey CA,"6100 Broadway, Oakland, CA 94618",(510) 652-0111,,,,,https://www.linkedin.com/groups/131338/,http://www.college-prep.org/page/search-results,,linkedin,75,Tier 2,http://www.college-prep.org/about,http://www.college-prep.org/about,,"At The College Preparatory School in Downey, CA, we are dedicated to fostering a diverse and inclusive environment that prepares students for academic excellence and personal growth.",2026-02-17T02:07:22.332366,,,,
815f06b5-0486-485a-a982-de77473b29d2,Sylvan Learning of Downey,"Downey, CA",https://www.sylvanlearning.com/locations/us/ca/downey-tutoring/downey?utm_source=google&utm_medium=local&utm_campaign=localmaps&utm_content=8588,sylvanlearning.com,serpapi,College prep Downey CA,"8832 Imperial Hwy., Downey, CA 90242",(562) 445-3257,,,,,,,,phone_only,20,Tier 5,,,,"At Sylvan Learning of Downey, we empower students in Downey, CA, with personalized learning plans that cater to their unique strengths and challenges, ensuring academic success and confidence.",2026-02-17T02:07:23.523249,,,,
